### ISSUE TITLE
Kong to backend FastAPI service: 405 Method Not Allowed

### ISSUE THREAD

**Issue by surajvm1** [Kong/kong#13512]
### Is there an existing issue for this?

- [X] I have searched the existing issues

### Kong version (`$ kong version`)

3.x (kong:latest)

### Current Behavior

I have a backend FastAPI service which (say) is defined like this: 
```
GET/POST API service:

@app.get("/api/getWeather/{location}", response_model=WeatherResponse)
async def get_weather(location: str, db: Session = Depends(get_db)):
    # location is my query params which can keep changing based on request from frontend service
    weather = fetch_weather_from_postgres(db, location)
    if weather:
        response_data = {
        # some data 
        }
        return response_data

@app.post("/api/sendWeather")
async def send_weather(weather: WeatherData, db: Session = Depends(get_db)):
    '''
    Sample data expected: 
    {
      "user": "user",
      "location": "someLocation",
      "temperature": 25
    }
    '''
    add_weather_to_postgres(db, weather),
    # some data
    return response_data
```

Dockerfile of app:
```
FROM python:3.9-slim
ENV APP_HOME /internalWeatherServiceB
RUN mkdir $APP_HOME
WORKDIR $APP_HOME
COPY . /$APP_HOME
RUN pip install -r requirements.txt
EXPOSE 8900
ENTRYPOINT ["sh", "-c"]
CMD ["uvicorn app.main:app --host 0.0.0.0 --port 8900 --reload"]
```

Sample Docker compose file: 
```
version: '3'
networks:
  service_network:
    name: service_compose_network
services:
  internal_weather_service_b:
    build:
      context: ./internalWeatherServiceB
      dockerfile: Dockerfile
    container_name: internal_weather_service_b
    ports:
      - "8900:8900"
    env_file:
      - ./internalWeatherServiceB/.env
    networks:
      - service_network
    depends_on:
      - postgres_service
     
  kong_gateway_1:
    image: kong:latest
    container_name: kong_gateway_1
    environment:
      KONG_DATABASE: "off"
      KONG_DECLARATIVE_CONFIG: /kong/declarative/kong.yml
      KONG_PROXY_ACCESS_LOG: /dev/stdout
      KONG_ADMIN_ACCESS_LOG: /dev/stdout
      KONG_PROXY_ERROR_LOG: /dev/stderr
      KONG_ADMIN_ERROR_LOG: /dev/stderr
      KONG_ADMIN_LISTEN: "0.0.0.0:8001"
    volumes:
      - .././kongApiGateway/kong.yml:/kong/declarative/kong.yml
    ports:
      - "8000:8000"
      - "8001:8001"
    networks:
      - service_network
```

Now, if I hit just the backend service with a POST request: 

```
curl -X POST http://localhost:8900/api/sendWeather -H "Content-Type: application/json" -d '{"user": "usertest", "location": "someLocation", "temperature": 25}'
# I get success message 
```

But when I hit the API routed via Kong's service, I get error. Kong yml file:
```
_format_version: "3.0"
services:
  - name: internal-weather-service
    url: http://internal_weather_service_b:8900  
    routes:
      - name: internal-weather-route-GET
        paths:
          - /api/getWeather/*
        methods:
          - GET
      - name: internal-weather-route-POST
        paths:
          - /api/sendWeather
upstreams:
  - name: weather-upstream
    targets:
      - target: internal_weather_service_b:8900
        weight: 100
    healthchecks:
      active:
        http_path: "/" 
        healthy:
          interval: 180
          http_statuses: [200, 302]
          successes: 1
        unhealthy:
          interval: 120
          http_statuses: [429, 500, 503]
          tcp_failures: 3
          timeouts: 1
          http_failures: 3
```

When I hit cURL command: 
```
curl -X POST http://localhost:8000/api/sendWeather -H "Content-Type: application/json" -d '{"user": "testuser", "location": "someLocation", "temperature": 25}'
Output: {"detail":"Method Not Allowed"}                                  
```

Error in Kong/FastAPI service logs: `"POST / HTTP/1.1" 405 Method Not Allowed` 

As part of debugging, I commented all routes except POST route and ran: 
```
GET: http://localhost:8001/routes
        {
            "regex_priority": 0,
            "snis": null,
            "tags": null,
            "protocols": [
                "http",
                "https"
            ],
            "paths": [
                "/api/sendWeather"
            ],
            "request_buffering": true,
            "response_buffering": true,
            "path_handling": "v0",
            "created_at": 1724007558,
            "updated_at": 1724007558,
            "https_redirect_status_code": 426,
            "id": "cd397c5b-437f-5d40-8ecf-8aaa8285d9f3",
            "hosts": null,
            "preserve_host": false,
            "name": "internal-weather-route-POST",
            "strip_path": true,
            "sources": null,
            "destinations": null,
            "headers": null,
            "methods": [
                "POST"
            ],
            "service": {
                "id": "35bfcec6-69c9-5f7b-8539-5e4a33befffd"
            }
        },
```

```
GET: http://localhost:8001/services
{
            "name": "internal-weather-service",
            "tags": null,
            "ca_certificates": null,
            "protocol": "http",
            "connect_timeout": 60000,
            "read_timeout": 60000,
            "tls_verify": null,
            "created_at": 1724007558,
            "host": "internal_weather_service_b",
            "id": "35bfcec6-69c9-5f7b-8539-5e4a33befffd",
            "write_timeout": 60000,
            "port": 8900,
            "path": null,
            "retries": 5,
            "client_certificate": null,
            "updated_at": 1724007558,
            "tls_verify_depth": null,
            "enabled": true
        }
```

Kong test error: 
<img width="744" alt="Screenshot 2024-08-19 at 1 05 45 AM" src="https://github.com/user-attachments/assets/53333fc0-60ee-4f70-8a24-937bca5ab6b9">

Normal POST directly to backend works: 
<img width="744" alt="Screenshot 2024-08-19 at 1 05 25 AM" src="https://github.com/user-attachments/assets/89523730-af05-40fd-864a-54cf15bf49fb">

The error persists. 

### Expected Behavior

It should POST data to API and return say ~ `{"message":"Weather data added successfully"}`.

**Comment by chobits** [comment]
hi @surajvm1 

I think kong might not reply the response like `{"detail": "Method Not allowed"}`
Its like some firewall or some software intercepted the package during the proxying link , like `firewall/software -> kong -> backend` or `kong -> firewall/software -> backend`

Could you use curl option `-sv` to show the complete headers of resposne, from these information we could see whether there are some hints.

**Comment by surajvm1** [comment]
hi @chobits, 
Noted. This is what I get: 

```
Command when I hit server via Kong: 

curl -sv -X POST http://localhost:8000/api/sendWeather \
-H "Content-Type: application/json" \
-d '{"user": "someUser", "location": "someLocation", "temperature": 25}'
* Host localhost:8000 was resolved.
* IPv6: ::1
* IPv4: 127.0.0.1
*   Trying [::1]:8000...
* Connected to localhost (::1) port 8000
> POST /api/sendWeather HTTP/1.1
> Host: localhost:8000
> User-Agent: curl/8.5.0
> Accept: */*
> Content-Type: application/json
> Content-Length: 67
> 
< HTTP/1.1 405 Method Not Allowed
< Content-Type: application/json
< Content-Length: 31
< Connection: keep-alive
< date: Mon, 19 Aug 2024 07:03:02 GMT
< server: uvicorn
< allow: GET
< X-Kong-Upstream-Latency: 2
< X-Kong-Proxy-Latency: 5
< Via: kong/3.7.1
< X-Kong-Request-Id: 37409070d4af7d35212329477bb9ba5f
< 
* Connection #0 to host localhost left intact
{"detail":"Method Not Allowed"}

Command when I directly hit the server: 

curl -sv -X POST http://localhost:8900/api/sendWeather \
-H "Content-Type: application/json" \
-d '{"user": "someUser", "location": "someLocation", "temperature": 25}'
* Host localhost:8900 was resolved.
* IPv6: ::1
* IPv4: 127.0.0.1
*   Trying [::1]:8900...
* Connected to localhost (::1) port 8900
> POST /api/sendWeather HTTP/1.1
> Host: localhost:8900
> User-Agent: curl/8.5.0
> Accept: */*
> Content-Type: application/json
> Content-Length: 67
> 
< HTTP/1.1 200 OK
< date: Mon, 19 Aug 2024 07:52:57 GMT
< server: uvicorn
< content-length: 45
< content-type: application/json
< 
* Connection #0 to host localhost left intact
{"message":"Weather data added successfully"}
```

If I interpret it myself, seems like uvicorn is allowing only GET requests for any external services trying to hit the endpoint, do you agree or have any thoughts? Though it makes me wonder, when I hit the service via a frontend service it works properly, but when hit via Kong, its throwing 405 error.

**Comment by chobits** [comment]
> hi @chobits, Noted. This is what I get:
> 
> ```
> Command when I hit server via Kong: 
> 
> curl -sv -X POST http://localhost:8000/api/sendWeather \
> -H "Content-Type: application/json" \
> -d '{"user": "someUser", "location": "someLocation", "temperature": 25}'
> * Host localhost:8000 was resolved.
> * IPv6: ::1
> * IPv4: 127.0.0.1
> *   Trying [::1]:8000...
> * Connected to localhost (::1) port 8000
> > POST /api/sendWeather HTTP/1.1
> > Host: localhost:8000
> > User-Agent: curl/8.5.0
> > Accept: */*
> > Content-Type: application/json
> > Content-Length: 67
> > 
> < HTTP/1.1 405 Method Not Allowed
> < Content-Type: application/json
> < Content-Length: 31
> < Connection: keep-alive
> < date: Mon, 19 Aug 2024 07:03:02 GMT
> < server: uvicorn
> < allow: GET
> < X-Kong-Upstream-Latency: 2
> < X-Kong-Proxy-Latency: 5
> < Via: kong/3.7.1
> < X-Kong-Request-Id: 37409070d4af7d35212329477bb9ba5f
> < 
> * Connection #0 to host localhost left intact
> {"detail":"Method Not Allowed"}

From this response from Kong, we could see that the response was replied by backend , see `server: uvicorn`

I guess that this POST request might be slightly modified by kong, then the modified request was replied by backend with 405. You could capture the packages between kong and backend server. Maybe try some command like this:

```
tcpdump -s 0 -A -i any dst port 8900
```

**Comment by surajvm1** [comment]
@chobits; 
I listened to packets on both ports: 
On: `tcpdump -s 0 -A -i any dst port 8900`
There is no output: 
```
(base) ➜  ~ sudo tcpdump -s 0 -A -i any dst port 8900               
tcpdump: data link type PKTAP
tcpdump: verbose output suppressed, use -v[v]... for full protocol decode
listening on any, link-type PKTAP (Apple DLT_PKTAP), snapshot length 524288 bytes
```

On: `tcpdump -s 0 -A -i any dst port 8000`
There is some output: 
```
(base) ➜  ~ sudo tcpdump -s 0 -A -i any dst port 8000
Password:
tcpdump: data link type PKTAP
tcpdump: verbose output suppressed, use -v[v]... for full protocol decode
listening on any, link-type PKTAP (Apple DLT_PKTAP), snapshot length 524288 bytes
13:34:31.505322 IP6 localhost.58833 > localhost.irdmi: Flags [S], seq 812050709, win 65535, options [mss 16324,nop,wscale 6,nop,nop,TS val 2776845005 ecr 0,sackOK,eol], length 0
`....,.@...................................@0f...........4....?........
..J.........
13:34:31.505352 IP6 localhost.58833 > localhost.irdmi: Flags [S], seq 812050709, win 65535, options [mss 16324,nop,wscale 6,nop,nop,TS val 2776845005 ecr 0,sackOK,eol], length 0
`....,.@...................................@0f...........4....?........
..J.........
13:34:31.505606 IP6 localhost.58833 > localhost.irdmi: Flags [.], ack 2817448087, win 6371, options [nop,nop,TS val 2776845005 ecr 1745749594], length 0
`.... .@...................................@0f...........(.....
..J.h..Z
13:34:31.505612 IP6 localhost.58833 > localhost.irdmi: Flags [.], ack 1, win 6371, options [nop,nop,TS val 2776845005 ecr 1745749594], length 0
`.... .@...................................@0f...........(.....
..J.h..Z
13:34:31.505675 IP6 localhost.58833 > localhost.irdmi: Flags [P.], seq 0:212, ack 1, win 6371, options [nop,nop,TS val 2776845005 ecr 1745749594], length 212
`......@...................................@0f.................
..J.h..ZPOST /api/sendWeather HTTP/1.1
Host: localhost:8000
User-Agent: curl/8.5.0
Accept: */*
Content-Type: application/json
Content-Length: 67

{"user": "someUser", "location": "someLocation", "temperature": 25}
13:34:31.505694 IP6 localhost.58833 > localhost.irdmi: Flags [P.], seq 0:212, ack 1, win 6371, options [nop,nop,TS val 2776845005 ecr 1745749594], length 212
`......@...................................@0f.................
..J.h..ZPOST /api/sendWeather HTTP/1.1
Host: localhost:8000
User-Agent: curl/8.5.0
Accept: */*
Content-Type: application/json
Content-Length: 67

{"user": "someUser", "location": "someLocation", "temperature": 25}
13:34:31.515340 IP6 localhost.58833 > localhost.irdmi: Flags [.], ack 332, win 6366, options [nop,nop,TS val 2776845015 ecr 1745749604], length 0
`.... .@...................................@0f...........(.....
..J.h..d
13:34:31.515359 IP6 localhost.58833 > localhost.irdmi: Flags [.], ack 332, win 6366, options [nop,nop,TS val 2776845015 ecr 1745749604], length 0
`.... .@...................................@0f...........(.....
..J.h..d
13:34:31.515461 IP6 localhost.58833 > localhost.irdmi: Flags [F.], seq 212, ack 332, win 6366, options [nop,nop,TS val 2776845015 ecr 1745749604], length 0
`.... .@...................................@0f...........(.....
..J.h..d
13:34:31.515471 IP6 localhost.58833 > localhost.irdmi: Flags [F.], seq 212, ack 332, win 6366, options [nop,nop,TS val 2776845015 ecr 1745749604], length 0
`.... .@...................................@0f...........(.....
..J.h..d
13:35:31.514554 IP6 localhost.58833 > localhost.irdmi: Flags [.], ack 332, win 6366, length 0
`......@...................................@0f......P.......
13:35:31.514585 IP6 localhost.58833 > localhost.irdmi: Flags [R.], seq 213, ack 332, win 6366, length 0
`......@...................................@0f......P.......
13:35:31.514710 IP6 localhost.58833 > localhost.irdmi: Flags [R], seq 812050923, win 0, length 0
`......@...................................@0f......P.......
13:35:31.514714 IP6 localhost.58833 > localhost.irdmi: Flags [.], ack 332, win 6366, length 0
`......@...................................@0f......P.......
13:35:31.514716 IP6 localhost.58833 > localhost.irdmi: Flags [R.], seq 213, ack 332, win 6366, length 0
`......@...................................@0f......P.......
13:35:31.514718 IP6 localhost.58833 > localhost.irdmi: Flags [R], seq 812050923, win 0, length 0
`......@...................................@0f......P.......
13:35:31.514780 IP6 localhost.58833 > localhost.irdmi: Flags [R], seq 812050923, win 0, length 0
`......@...................................@0f......P.......
13:35:31.514782 IP6 localhost.58833 > localhost.irdmi: Flags [R], seq 812050923, win 0, length 0
`......@...................................@0f......P.......

```

**Comment by chobits** [comment]
I don't know why you could not capture package from 8900. 

But i think the key point is that the request from kong to backend, then backend will reply 405.
The request is directly sent to backend, it will reply 200.

So why does this happen? It might be one of the following two questions

1. Kong modified the request, maybe add some header or some other related info
2. Backend server will have different behaviour based on different incoming package source addresses.

So from this point, you could think of some methods to debug this based on my guessing, like package capturing or checking the backend access logs.
