### ISSUE TITLE
Upgrade to 2.4+ cause 503 on k8s external services proxying

### ISSUE THREAD

**Issue by cdrappier** [Kong/kong#7771]
After trying different versions including : 
- 2.3.3-> Actual version I use in production
- 2.4.0
- 2.4.1
- 2.5.0
- K8s version : 1.20.8

### Summary
It appears I reproduce that bug on all versions after 2.4.0 (included)
There is no change between all my tests except the kong version
The bug appears on a request, proxied by kong, to aws s3 services.
On 1/10 of the requests I got a 503, all other requests are working perfectly.
(1/50 since I've upgraded ingress controller from 1.3.1 to 1.3.2)

### Steps To Reproduce
1 - Install kong on k8s with standard configuration with the latest ingress-controller and latest kong version (1.3.2 and 2.5.0)
2 - Create an external service in your k8s
```yaml
apiVersion: v1
kind: Service
metadata:
  name: test
  namespace: my-namespace
  labels:
    type: external
  annotations:
    konghq.com/plugins: ''
    konghq.com/protocol: https
spec:
  type: ExternalName
  sessionAffinity: None
  externalName: s3.eu-west-1.amazonaws.com
```
3 - Create an ingress in your k8s pointing on that service (I have my own tls certificate because kong serve that url in https)
```yaml
apiVersion: networking.k8s.io/v1
kind: Ingress
metadata:
  name: test
  namespace: my-namespace
  annotations:
    konghq.com/https-redirect-status-code: '302'
    konghq.com/preserve-host: 'true'
    konghq.com/protocols: https
    konghq.com/strip-path: 'true'
    kubernetes.io/ingress.class: kong
spec:
  tls:
    - hosts:
        - myhost.io
      secretName: mysecrettls
  rules:
    - host: myhost.io
      http:
        paths:
          - path: /test
            pathType: ImplementationSpecific
            backend:
              service:
                name: test
                port:
                  number: 443
```
4 - Call the root url https://myhost.io/test
It should send 404 by default with an error "No such bucket" -> In normal use case I've added some custom plugin to do authentication, but with or without that custom plugin, I reproduce the same error.
What is important here, is that sometimes, instead of 404, I received 503 error since 2.4.0
The error message display with the 503 is
```
  "message": "failure to get a peer from the ring-balancer"
```

### Additional Details & Logs
- Kong debug-level on request success
```
2021/08/26 13:31:20 [debug] 22#0: *538 [lua] pkey.lua:52: load_pem_der(): load key using fmt: *, type: *
2021/08/26 13:31:20 [debug] 22#0: *538 [lua] pkey.lua:74: load_pem_der(): jwk decode failed: error decoding JSON from JWK: Expected value but found invalid number at character 1, continuing
2021/08/26 13:31:20 [debug] 22#0: *538 [lua] pkey.lua:110: load_pem_der(): pkey:load_pem_der: loaded pkey using function PEM_read_bio_PUBKEY
2021/08/26 13:31:20 [debug] 22#0: *538 [lua] init.lua:972: balancer(): setting address (try 1): XX.XXX.XX.XX:8000
2021/08/26 13:31:20 [debug] 22#0: *538 [lua] init.lua:1001: balancer(): enabled connection keepalive (pool=XX.XXX.XX.XX|8000, pool_size=60, idle_timeout=60, max_requests=100)
2021/08/26 13:31:20 [debug] 22#0: *539 [lua] base.lua:647: queryDns(): [upstream:test.my-namespace.443.svc 46] querying dns for s3.eu-west-1.amazonaws.com
2021/08/26 13:31:20 [debug] 22#0: *539 [lua] base.lua:500: f(): [upstream:test.my-namespace.443.svc 46] no dns changes detected for s3.eu-west-1.amazonaws.com
2021/08/26 13:31:20 [debug] 22#0: *539 [lua] init.lua:972: balancer(): setting address (try 1): XX.XXX.XX.XX:443
2021/08/26 13:31:20 [debug] 22#0: *539 [lua] init.lua:1001: balancer(): enabled connection keepalive (pool=XX.XXX.XX.XXX|443|myhost.io, pool_size=60, idle_timeout=60, max_requests=100)
XX.XX.XXX.XXX - - [26/Aug/2021:13:31:20 +0000] "GET /test HTTP/2.0" 404 309 "-" "curl/7.64.1"
```
- Kong debug level on request faillure
```

2021/08/26 13:31:20 [debug] 22#0: *547 [lua] base.lua:647: queryDns(): [upstream:test.my-namespace.443.svc 46] querying dns for s3.eu-west-1.amazonaws.com
2021/08/26 13:31:20 [debug] 22#0: *547 [lua] base.lua:583: f(): [upstream:test.my-namespace.443.svc 46] new dns record entry for s3.eu-west-1.amazonaws.com: XX.XXX.XX.XXX:nil
2021/08/26 13:31:20 [debug] 22#0: *547 [lua] base.lua:368: newAddress(): [upstream:test.my-namespace.443.svc 46] new address for host 's3.eu-west-1.amazonaws.com' created: XX.XXX.XX.XXX:443 (weight 100)
2021/08/26 13:31:20 [debug] 22#0: *547 [lua] base.lua:610: f(): [upstream:test.my-namespace.443.svc 46] removed dns record entry for s3.eu-west-1.amazonaws.com: XX.XXX.XX.XX:nil
2021/08/26 13:31:20 [debug] 22#0: *547 [lua] base.lua:242: disable(): [upstream:test.my-namespace.443.svc 46] disabling address: XX.XXX.XX.XX:443 (host s3.eu-west-1.amazonaws.com)
2021/08/26 13:31:20 [debug] 22#0: *547 [lua] base.lua:266: change(): [upstream:test.my-namespace.443.svc 46] changing address weight: XX.XXX.XX.XX:443(host s3.eu-west-1.amazonaws.com) 100 -> 0
2021/08/26 13:31:20 [debug] 22#0: *547 [lua] base.lua:626: f(): [upstream:test.my-namespace.443.svc 46] updating balancer based on dns changes for s3.eu-west-1.amazonaws.com
2021/08/26 13:31:20 [debug] 22#0: *547 [lua] base.lua:255: delete(): [upstream:test.my-namespace.443.svc 46] deleting address: XX.XXX.XX.XX:443 (host s3.eu-west-1.amazonaws.com)
2021/08/26 13:31:20 [debug] 22#0: *547 [lua] base.lua:636: f(): [upstream:test.my-namespace.443.svc 46] querying dns and updating for s3.eu-west-1.amazonaws.com completed
2021/08/26 13:31:20 [debug] 22#0: *547 [lua] base.lua:812: addressStillValid(): [upstream:test.my-namespace.443.svc 46] DNS record for s3.eu-west-1.amazonaws.com was updated and no longer contains the address
XX.XX.XXX.XXX - - [26/Aug/2021:13:31:20 +0000] "GET /test HTTP/2.0" 503 58 "-" "curl/7.64.1"
```

Other linked issue (not 100% sure) : https://github.com/Kong/kong/issues/7428
It has been closed, but while the downgrade to kong 2.3.3 works to repair the issue, I'm not sure of what to do right now.

**Comment by javierguerragiraldez** [comment]
the logs on the failing case say that there was some DNS changes that removed the queried address.  Can you verify if that's the case?  either doing a manual query before and after the failure, or capturing the DNS traffic...

**Comment by cdrappier** [comment]
For test, I've done a small loop in shell for calling the kong endpoint, it send me an error every 30 call with that implementation.

I've launch the same script inside the kong pod, with curl, with the external service name provide in the kube ingress (s3 url)
It never send me any error with DNS.
That script was launch in the same time than the other (the other return 503 every 30 call)

Sample of curl result in verbose mode from inside the pod
```
bash-5.1$ curl -X GET -vv https://s3.eu-west-1.amazonaws.com/test222
Note: Unnecessary use of -X or --request, GET is already inferred.
*   Trying 52.218.37.18:443...
* Connected to s3.eu-west-1.amazonaws.com (52.218.37.18) port 443 (#0)
* ALPN, offering h2
* ALPN, offering http/1.1
* successfully set certificate verify locations:
*  CAfile: /etc/ssl/certs/ca-certificates.crt
*  CApath: none
* TLSv1.3 (OUT), TLS handshake, Client hello (1):
* TLSv1.3 (IN), TLS handshake, Server hello (2):
* TLSv1.2 (IN), TLS handshake, Certificate (11):
* TLSv1.2 (IN), TLS handshake, Server key exchange (12):
* TLSv1.2 (IN), TLS handshake, Server finished (14):
* TLSv1.2 (OUT), TLS handshake, Client key exchange (16):
* TLSv1.2 (OUT), TLS change cipher, Change cipher spec (1):
* TLSv1.2 (OUT), TLS handshake, Finished (20):
* TLSv1.2 (IN), TLS handshake, Finished (20):
* SSL connection using TLSv1.2 / ECDHE-RSA-AES128-GCM-SHA256
* ALPN, server did not agree to a protocol
* Server certificate:
*  subject: C=US; ST=Washington; L=Seattle; O=Amazon.com, Inc.; CN=*.s3-eu-west-1.amazonaws.com
*  start date: Jun 23 00:00:00 2021 GMT
*  expire date: Jul 24 23:59:59 2022 GMT
*  subjectAltName: host "s3.eu-west-1.amazonaws.com" matched cert's "s3.eu-west-1.amazonaws.com"
*  issuer: C=US; O=DigiCert Inc; OU=www.digicert.com; CN=DigiCert Baltimore CA-2 G2
*  SSL certificate verify ok.
> GET /test222 HTTP/1.1
> Host: s3.eu-west-1.amazonaws.com
> User-Agent: curl/7.78.0
> Accept: */*
> 
* Mark bundle as not supporting multiuse
< HTTP/1.1 403 Forbidden
< x-amz-bucket-region: eu-west-1
< x-amz-request-id: XXXXX
< x-amz-id-2: XXXXXX=
< Content-Type: application/xml
< Transfer-Encoding: chunked
< Date: Tue, 07 Sep 2021 09:29:12 GMT
< Server: AmazonS3
< 
<?xml version="1.0" encoding="UTF-8"?>
* Connection #0 to host s3.eu-west-1.amazonaws.com left intact
<Error><Code>AccessDenied</Code><Message>Access Denied</Message><RequestId>XXXXX</RequestId><HostId>XXXXXXX=</HostId></Error>
```


Example of error calling it through kong
```
curl -vv https://test.forepaas.io/test2/
*   Trying 35.240.19.58...
* TCP_NODELAY set
* Connected to test.forepaas.io (X.X.X.X) port 443 (#0)
* ALPN, offering h2
* ALPN, offering http/1.1
* successfully set certificate verify locations:
*   CAfile: /etc/ssl/cert.pem
  CApath: none
* TLSv1.2 (OUT), TLS handshake, Client hello (1):
* TLSv1.2 (IN), TLS handshake, Server hello (2):
* TLSv1.2 (IN), TLS handshake, Certificate (11):
* TLSv1.2 (IN), TLS handshake, Server key exchange (12):
* TLSv1.2 (IN), TLS handshake, Server finished (14):
* TLSv1.2 (OUT), TLS handshake, Client key exchange (16):
* TLSv1.2 (OUT), TLS change cipher, Change cipher spec (1):
* TLSv1.2 (OUT), TLS handshake, Finished (20):
* TLSv1.2 (IN), TLS change cipher, Change cipher spec (1):
* TLSv1.2 (IN), TLS handshake, Finished (20):
* SSL connection using TLSv1.2 / ECDHE-RSA-AES256-GCM-SHA384
* ALPN, server accepted to use h2
* Server certificate:
*  subject: CN=*.forepaas.io
*  start date: Jun  4 00:00:00 2020 GMT
*  expire date: Jun  4 23:59:59 2022 GMT
*  subjectAltName: host "test.forepaas.io" matched cert's "*.forepaas.io"
*  issuer: C=GB; ST=Greater Manchester; L=Salford; O=Sectigo Limited; CN=Sectigo RSA Domain Validation Secure Server CA
*  SSL certificate verify ok.
* Using HTTP2, server supports multi-use
* Connection state changed (HTTP/2 confirmed)
* Copying HTTP/2 data in stream buffer to connection buffer after upgrade: len=0
* Using Stream ID: 1 (easy handle 0x7f8be700d600)
> GET /test2/ HTTP/2
> Host: test.forepaas.io
> User-Agent: curl/7.64.1
> Accept: */*
> 
* Connection state changed (MAX_CONCURRENT_STREAMS == 128)!
< HTTP/2 503 
< date: Tue, 07 Sep 2021 09:34:13 GMT
< content-type: application/json; charset=utf-8
< content-length: 58
< 
* Connection #0 to host test.forepaas.io left intact
{"message":"failure to get a peer from the ring-balancer"}* Closing connection 0
```

I will try to do a tcpdump to get more informations, if you get specific command that could be helpfull, let me know.

**Comment by javierguerragiraldez** [comment]
> I've launch the same script inside the kong pod, with curl, with the external service name provide in the kube ingress (s3 url)
> -> It never send me any error with DNS.

Curl uses the system resolver, which prioritizes cache as much as possible, in the event of an empty DNS response, it would probably use the previous value, while Kong tries to follow any DNS change as soon as possible, in order to keep its balancer algorithms up to date.

something like `tcpdump -i eth0 port 53 -w dns.pcap` would capture the whole DNS traffic and see what resulted in those "removed dns record entry for s3.eu-west-1.amazonaws.com: XX.XXX.XX.XX:nil" messages

**Comment by carlosrmendes** [comment]
Same for me, after updating from v2.2 to v2.5.

My kubernetes is an AKS cluster, running on Azure. No errors on coredns pods and I have a pod doing some internal DNS checks every 0.25 seconds.

**Comment by carlosrmendes** [comment]
from time to time, this error appears on the logs, failing the requests:
```
2021/09/07 23:07:18 [error] 65#0: *932744 [lua] openidc.lua:497: openidc_discover(): could not decode JSON from Discovery data: response indicates failure, status=503, body={"message":"failure to get a peer from the ring-balancer"}, client: 188.250.80.26, server: kong, request: "GET /monitoring/prometheus/ HTTP/2.0", host: "<omitted>"
```

**Comment by cdrappier** [comment]
With tcpdump I get more clues

Here when it's working, resolution seem fine
```
12:51:30.002726 IP ingress-kong-58cc854b5f-zcffw.55367 > kube-dns.kube-system.svc.cluster.local.53: 51183+ PTR? 10.0.156.10.in-addr.arpa. (42)
12:51:30.009145 IP kube-dns.kube-system.svc.cluster.local.53 > ingress-kong-58cc854b5f-zcffw.55367: 51183 1/0/0 PTR kube-dns.kube-system.svc.cluster.local. (94)
12:51:30.672861 IP ingress-kong-58cc854b5f-zcffw.41920 > kube-dns.kube-system.svc.cluster.local.53: 47886+ A? s3.eu-west-1.amazonaws.com. (44)
12:51:30.685200 IP kube-dns.kube-system.svc.cluster.local.53 > ingress-kong-58cc854b5f-zcffw.41920: 47886 1/0/0 A 52.218.90.67 (60)
12:51:36.311332 IP ingress-kong-58cc854b5f-zcffw.52781 > kube-dns.kube-system.svc.cluster.local.53: 46470+ A? s3.eu-west-1.amazonaws.com. (44)
12:51:36.322346 IP kube-dns.kube-system.svc.cluster.local.53 > ingress-kong-58cc854b5f-zcffw.52781: 46470 1/0/0 A 52.218.90.227 (60)
```

And when it's not working, it look like trying to resolve with internal routes : **.fp-cluster-manager.svc.cluster.local.** 
```
12:51:37.219987 IP ingress-kong-58cc854b5f-zcffw.39142 > kube-dns.kube-system.svc.cluster.local.53: 20213+ A? s3.eu-west-1.amazonaws.com.fp-cluster-manager.svc.cluster.local. (81)
12:51:37.220112 IP ingress-kong-58cc854b5f-zcffw.55997 > kube-dns.kube-system.svc.cluster.local.53: 46003+ A? s3.eu-west-1.amazonaws.com.svc.cluster.local. (62)
12:51:37.220207 IP ingress-kong-58cc854b5f-zcffw.49594 > kube-dns.kube-system.svc.cluster.local.53: 496+ A? s3.eu-west-1.amazonaws.com.cluster.local. (58)
12:51:37.220766 IP kube-dns.kube-system.svc.cluster.local.53 > ingress-kong-58cc854b5f-zcffw.49594: 496 NXDomain 0/1/0 (151)
12:51:37.220771 IP kube-dns.kube-system.svc.cluster.local.53 > ingress-kong-58cc854b5f-zcffw.55997: 46003 NXDomain 0/1/0 (155)
12:51:37.222121 IP kube-dns.kube-system.svc.cluster.local.53 > ingress-kong-58cc854b5f-zcffw.39142: 20213 NXDomain 0/1/0 (174)
```


A complete stack here : 
```
12:34:17.009731 IP kube-dns.kube-system.svc.cluster.local.53 > ingress-kong-58cc854b5f-zcffw.44856: 48769 NXDomain 0/1/0 (165)
12:34:21.009006 IP ingress-kong-58cc854b5f-zcffw.39288 > kube-dns.kube-system.svc.cluster.local.53: 27527+ A? s3.eu-west-1.amazonaws.com. (44)
12:34:21.017766 IP kube-dns.kube-system.svc.cluster.local.53 > ingress-kong-58cc854b5f-zcffw.39288: 27527 1/0/0 A 52.218.104.74 (60)
12:34:27.012663 IP ingress-kong-58cc854b5f-zcffw.38153 > kube-dns.kube-system.svc.cluster.local.53: 21816+ A? s3.eu-west-1.amazonaws.com. (44)
12:34:27.027149 IP kube-dns.kube-system.svc.cluster.local.53 > ingress-kong-58cc854b5f-zcffw.38153: 21816 1/0/0 A 52.218.122.88 (60)
12:34:33.013818 IP ingress-kong-58cc854b5f-zcffw.44364 > kube-dns.kube-system.svc.cluster.local.53: 24606+ A? s3.eu-west-1.amazonaws.com. (44)
12:34:33.028285 IP kube-dns.kube-system.svc.cluster.local.53 > ingress-kong-58cc854b5f-zcffw.44364: 24606 1/0/0 A 52.218.61.59 (60)
12:34:39.015695 IP ingress-kong-58cc854b5f-zcffw.54061 > kube-dns.kube-system.svc.cluster.local.53: 46544+ A? s3.eu-west-1.amazonaws.com. (44)
12:34:39.027918 IP kube-dns.kube-system.svc.cluster.local.53 > ingress-kong-58cc854b5f-zcffw.54061: 46544 1/0/0 A 52.218.88.43 (60)
12:34:45.024580 IP ingress-kong-58cc854b5f-zcffw.50957 > kube-dns.kube-system.svc.cluster.local.53: 16925+ A? s3.eu-west-1.amazonaws.com. (44)
12:34:45.037995 IP kube-dns.kube-system.svc.cluster.local.53 > ingress-kong-58cc854b5f-zcffw.50957: 16925 1/0/0 A 52.218.89.211 (60)
12:34:46.026313 IP ingress-kong-58cc854b5f-zcffw.34879 > kube-dns.kube-system.svc.cluster.local.53: 25094+ A? s3.eu-west-1.amazonaws.com.fp-cluster-manager.svc.cluster.local. (81)
12:34:46.026399 IP ingress-kong-58cc854b5f-zcffw.47527 > kube-dns.kube-system.svc.cluster.local.53: 32181+ A? s3.eu-west-1.amazonaws.com.svc.cluster.local. (62)
12:34:46.026457 IP ingress-kong-58cc854b5f-zcffw.52753 > kube-dns.kube-system.svc.cluster.local.53: 5015+ A? s3.eu-west-1.amazonaws.com.cluster.local. (58)
12:34:46.026507 IP ingress-kong-58cc854b5f-zcffw.44596 > kube-dns.kube-system.svc.cluster.local.53: 6909+ A? s3.eu-west-1.amazonaws.com.c.razorback-299023.internal. (72)
12:34:46.026572 IP ingress-kong-58cc854b5f-zcffw.34926 > kube-dns.kube-system.svc.cluster.local.53: 53833+ A? s3.eu-west-1.amazonaws.com.google.internal. (60)
12:34:46.027255 IP kube-dns.kube-system.svc.cluster.local.53 > ingress-kong-58cc854b5f-zcffw.47527: 32181 NXDomain 0/1/0 (155)
12:34:46.028910 IP kube-dns.kube-system.svc.cluster.local.53 > ingress-kong-58cc854b5f-zcffw.52753: 5015 NXDomain 0/1/0 (151)
12:34:46.028924 IP kube-dns.kube-system.svc.cluster.local.53 > ingress-kong-58cc854b5f-zcffw.34879: 25094 NXDomain 0/1/0 (174)
12:34:46.031567 IP kube-dns.kube-system.svc.cluster.local.53 > ingress-kong-58cc854b5f-zcffw.34926: 53833 NXDomain 0/1/0 (149)
12:34:46.037586 IP kube-dns.kube-system.svc.cluster.local.53 > ingress-kong-58cc854b5f-zcffw.44596: 6909 NXDomain 0/1/0 (161)
12:34:51.026632 IP ingress-kong-58cc854b5f-zcffw.38368 > kube-dns.kube-system.svc.cluster.local.53: 35314+ A? s3.eu-west-1.amazonaws.com. (44)
12:34:51.039927 IP kube-dns.kube-system.svc.cluster.local.53 > ingress-kong-58cc854b5f-zcffw.38368: 35314 1/0/0 A 52.218.121.240 (60)
12:34:57.030186 IP ingress-kong-58cc854b5f-zcffw.45371 > kube-dns.kube-system.svc.cluster.local.53: 19274+ A? s3.eu-west-1.amazonaws.com. (44)
12:34:57.048110 IP kube-dns.kube-system.svc.cluster.local.53 > ingress-kong-58cc854b5f-zcffw.45371: 19274 1/0/0 A 52.218.57.219 (60)
12:35:03.031928 IP ingress-kong-58cc854b5f-zcffw.43761 > kube-dns.kube-system.svc.cluster.local.53: 24929+ A? s3.eu-west-1.amazonaws.com. (44)
12:35:03.042511 IP kube-dns.kube-system.svc.cluster.local.53 > ingress-kong-58cc854b5f-zcffw.43761: 24929 1/0/0 A 52.218.91.59 (60)
12:35:09.036624 IP ingress-kong-58cc854b5f-zcffw.57932 > kube-dns.kube-system.svc.cluster.local.53: 21667+ A? s3.eu-west-1.amazonaws.com. (44)
12:35:09.048550 IP kube-dns.kube-system.svc.cluster.local.53 > ingress-kong-58cc854b5f-zcffw.57932: 21667 1/0/0 A 52.218.29.83 (60)
12:35:15.046524 IP ingress-kong-58cc854b5f-zcffw.49675 > kube-dns.kube-system.svc.cluster.local.53: 56263+ A? s3.eu-west-1.amazonaws.com. (44)
12:35:15.056352 IP kube-dns.kube-system.svc.cluster.local.53 > ingress-kong-58cc854b5f-zcffw.49675: 56263 1/0/0 A 52.218.28.27 (60)
12:35:16.048065 IP ingress-kong-58cc854b5f-zcffw.58277 > kube-dns.kube-system.svc.cluster.local.53: 18108+ A? s3.eu-west-1.amazonaws.com.fp-cluster-manager.svc.cluster.local. (81)
12:35:16.048158 IP ingress-kong-58cc854b5f-zcffw.46034 > kube-dns.kube-system.svc.cluster.local.53: 2659+ A? s3.eu-west-1.amazonaws.com.svc.cluster.local. (62)
12:35:16.048202 IP ingress-kong-58cc854b5f-zcffw.45600 > kube-dns.kube-system.svc.cluster.local.53: 30821+ A? s3.eu-west-1.amazonaws.com.cluster.local. (58)
12:35:16.048237 IP ingress-kong-58cc854b5f-zcffw.45373 > kube-dns.kube-system.svc.cluster.local.53: 23765+ A? s3.eu-west-1.amazonaws.com.c.razorback-299023.internal. (72)
12:35:16.048302 IP ingress-kong-58cc854b5f-zcffw.42755 > kube-dns.kube-system.svc.cluster.local.53: 20871+ A? s3.eu-west-1.amazonaws.com.google.internal. (60)
12:35:16.048904 IP kube-dns.kube-system.svc.cluster.local.53 > ingress-kong-58cc854b5f-zcffw.58277: 18108 NXDomain 0/1/0 (174)
12:35:16.049025 IP kube-dns.kube-system.svc.cluster.local.53 > ingress-kong-58cc854b5f-zcffw.46034: 2659 NXDomain 0/1/0 (155)
12:35:16.049122 IP kube-dns.kube-system.svc.cluster.local.53 > ingress-kong-58cc854b5f-zcffw.45600: 30821 NXDomain 0/1/0 (151)
12:35:16.051911 IP kube-dns.kube-system.svc.cluster.local.53 > ingress-kong-58cc854b5f-zcffw.42755: 20871 NXDomain 0/1/0 (149)
12:35:16.055660 IP kube-dns.kube-system.svc.cluster.local.53 > ingress-kong-58cc854b5f-zcffw.45373: 23765 NXDomain 0/1/0 (161)
12:35:21.047886 IP ingress-kong-58cc854b5f-zcffw.60752 > kube-dns.kube-system.svc.cluster.local.53: 6540+ A? s3.eu-west-1.amazonaws.com. (44)
12:35:21.058787 IP kube-dns.kube-system.svc.cluster.local.53 > ingress-kong-58cc854b5f-zcffw.60752: 6540 1/0/0 A 52.218.40.235 (60)
12:35:27.051213 IP ingress-kong-58cc854b5f-zcffw.34732 > kube-dns.kube-system.svc.cluster.local.53: 8368+ A? s3.eu-west-1.amazonaws.com. (44)
12:35:27.063542 IP kube-dns.kube-system.svc.cluster.local.53 > ingress-kong-58cc854b5f-zcffw.34732: 8368 1/0/0 A 52.218.120.8 (60)
12:35:33.053775 IP ingress-kong-58cc854b5f-zcffw.50486 > kube-dns.kube-system.svc.cluster.local.53: 1011+ A? s3.eu-west-1.amazonaws.com. (44)
12:35:33.067709 IP kube-dns.kube-system.svc.cluster.local.53 > ingress-kong-58cc854b5f-zcffw.50486: 1011 1/0/0 A 52.218.20.180 (60)
12:35:39.055163 IP ingress-kong-58cc854b5f-zcffw.55426 > kube-dns.kube-system.svc.cluster.local.53: 41135+ A? s3.eu-west-1.amazonaws.com. (44)
12:35:39.082312 IP kube-dns.kube-system.svc.cluster.local.53 > ingress-kong-58cc854b5f-zcffw.55426: 41135 1/0/0 A 52.218.53.170 (60)
12:35:45.056001 IP ingress-kong-58cc854b5f-zcffw.36510 > kube-dns.kube-system.svc.cluster.local.53: 17970+ A? s3.eu-west-1.amazonaws.com. (44)
12:35:45.066543 IP kube-dns.kube-system.svc.cluster.local.53 > ingress-kong-58cc854b5f-zcffw.36510: 17970 1/0/0 A 52.218.63.35 (60)
12:35:46.056869 IP ingress-kong-58cc854b5f-zcffw.33648 > kube-dns.kube-system.svc.cluster.local.53: 62214+ A? s3.eu-west-1.amazonaws.com.fp-cluster-manager.svc.cluster.local. (81)
12:35:46.056976 IP ingress-kong-58cc854b5f-zcffw.42189 > kube-dns.kube-system.svc.cluster.local.53: 46708+ A? s3.eu-west-1.amazonaws.com.svc.cluster.local. (62)
12:35:46.057014 IP ingress-kong-58cc854b5f-zcffw.48150 > kube-dns.kube-system.svc.cluster.local.53: 48232+ A? s3.eu-west-1.amazonaws.com.cluster.local. (58)
12:35:46.057052 IP ingress-kong-58cc854b5f-zcffw.37463 > kube-dns.kube-system.svc.cluster.local.53: 37399+ A? s3.eu-west-1.amazonaws.com.c.razorback-299023.internal. (72)
12:35:46.057121 IP ingress-kong-58cc854b5f-zcffw.37640 > kube-dns.kube-system.svc.cluster.local.53: 57116+ A? s3.eu-west-1.amazonaws.com.google.internal. (60)
12:35:46.057905 IP kube-dns.kube-system.svc.cluster.local.53 > ingress-kong-58cc854b5f-zcffw.42189: 46708 NXDomain 0/1/0 (155)
12:35:46.057918 IP kube-dns.kube-system.svc.cluster.local.53 > ingress-kong-58cc854b5f-zcffw.33648: 62214 NXDomain 0/1/0 (174)
12:35:46.059002 IP kube-dns.kube-system.svc.cluster.local.53 > ingress-kong-58cc854b5f-zcffw.48150: 48232 NXDomain 0/1/0 (151)
12:35:46.060414 IP kube-dns.kube-system.svc.cluster.local.53 > ingress-kong-58cc854b5f-zcffw.37463: 37399 NXDomain 0/1/0 (161)
12:35:46.062061 IP kube-dns.kube-system.svc.cluster.local.53 > ingress-kong-58cc854b5f-zcffw.37640: 57116 NXDomain 0/1/0 (149)
12:35:51.059155 IP ingress-kong-58cc854b5f-zcffw.47477 > kube-dns.kube-system.svc.cluster.local.53: 17642+ A? s3.eu-west-1.amazonaws.com. (44)
12:35:51.067493 IP kube-dns.kube-system.svc.cluster.local.53 > ingress-kong-58cc854b5f-zcffw.47477: 17642 1/0/0 A 52.218.108.27 (60)
12:35:57.059338 IP ingress-kong-58cc854b5f-zcffw.55945 > kube-dns.kube-system.svc.cluster.local.53: 32721+ A? s3.eu-west-1.amazonaws.com. (44)
12:35:57.075584 IP kube-dns.kube-system.svc.cluster.local.53 > ingress-kong-58cc854b5f-zcffw.55945: 32721 1/0/0 A 52.218.40.203 (60)
12:36:03.061916 IP ingress-kong-58cc854b5f-zcffw.40183 > kube-dns.kube-system.svc.cluster.local.53: 36829+ A? s3.eu-west-1.amazonaws.com. (44)
12:36:03.073855 IP kube-dns.kube-system.svc.cluster.local.53 > ingress-kong-58cc854b5f-zcffw.40183: 36829 1/0/0 A 52.218.28.11 (60)
12:36:09.065511 IP ingress-kong-58cc854b5f-zcffw.52498 > kube-dns.kube-system.svc.cluster.local.53: 44041+ A? s3.eu-west-1.amazonaws.com. (44)
12:36:09.078357 IP kube-dns.kube-system.svc.cluster.local.53 > ingress-kong-58cc854b5f-zcffw.52498: 44041 1/0/0 A 52.218.84.154 (60)
12:36:15.074738 IP ingress-kong-58cc854b5f-zcffw.37941 > kube-dns.kube-system.svc.cluster.local.53: 14305+ A? s3.eu-west-1.amazonaws.com. (44)
12:36:15.089388 IP kube-dns.kube-system.svc.cluster.local.53 > ingress-kong-58cc854b5f-zcffw.37941: 14305 1/0/0 A 52.218.88.19 (60)
12:36:16.074730 IP ingress-kong-58cc854b5f-zcffw.56744 > kube-dns.kube-system.svc.cluster.local.53: 51897+ A? s3.eu-west-1.amazonaws.com.fp-cluster-manager.svc.cluster.local. (81)
12:36:16.074835 IP ingress-kong-58cc854b5f-zcffw.40445 > kube-dns.kube-system.svc.cluster.local.53: 48141+ A? s3.eu-west-1.amazonaws.com.svc.cluster.local. (62)
12:36:16.074901 IP ingress-kong-58cc854b5f-zcffw.42569 > kube-dns.kube-system.svc.cluster.local.53: 33432+ A? s3.eu-west-1.amazonaws.com.cluster.local. (58)
12:36:16.074967 IP ingress-kong-58cc854b5f-zcffw.45210 > kube-dns.kube-system.svc.cluster.local.53: 5112+ A? s3.eu-west-1.amazonaws.com.c.razorback-299023.internal. (72)
12:36:16.075019 IP ingress-kong-58cc854b5f-zcffw.37439 > kube-dns.kube-system.svc.cluster.local.53: 31842+ A? s3.eu-west-1.amazonaws.com.google.internal. (60)
12:36:16.075494 IP kube-dns.kube-system.svc.cluster.local.53 > ingress-kong-58cc854b5f-zcffw.40445: 48141 NXDomain 0/1/0 (155)
12:36:16.076709 IP kube-dns.kube-system.svc.cluster.local.53 > ingress-kong-58cc854b5f-zcffw.42569: 33432 NXDomain 0/1/0 (151)
12:36:16.076714 IP kube-dns.kube-system.svc.cluster.local.53 > ingress-kong-58cc854b5f-zcffw.56744: 51897 NXDomain 0/1/0 (174)
12:36:16.079230 IP kube-dns.kube-system.svc.cluster.local.53 > ingress-kong-58cc854b5f-zcffw.37439: 31842 NXDomain 0/1/0 (149)
12:36:16.081294 IP kube-dns.kube-system.svc.cluster.local.53 > ingress-kong-58cc854b5f-zcffw.45210: 5112 NXDomain 0/1/0 (161)
12:36:21.078944 IP ingress-kong-58cc854b5f-zcffw.45628 > kube-dns.kube-system.svc.cluster.local.53: 5562+ A? s3.eu-west-1.amazonaws.com. (44)
12:36:21.090329 IP kube-dns.kube-system.svc.cluster.local.53 > ingress-kong-58cc854b5f-zcffw.45628: 5562 1/0/0 A 52.218.0.171 (60)
12:36:27.076357 IP ingress-kong-58cc854b5f-zcffw.39921 > kube-dns.kube-system.svc.cluster.local.53: 37184+ A? s3.eu-west-1.amazonaws.com. (44)
12:36:27.088881 IP kube-dns.kube-system.svc.cluster.local.53 > ingress-kong-58cc854b5f-zcffw.39921: 37184 1/0/0 A 52.218.121.152 (60)
12:36:33.079148 IP ingress-kong-58cc854b5f-zcffw.38064 > kube-dns.kube-system.svc.cluster.local.53: 39045+ A? s3.eu-west-1.amazonaws.com. (44)
12:36:33.103915 IP kube-dns.kube-system.svc.cluster.local.53 > ingress-kong-58cc854b5f-zcffw.38064: 39045 1/0/0 A 52.218.106.19 (60)
12:36:38.924015 IP ingress-kong-58cc854b5f-zcffw.38775 > kube-dns.kube-system.svc.cluster.local.53: 29708+ A? s3.eu-west-1.amazonaws.com. (44)
12:36:38.934323 IP kube-dns.kube-system.svc.cluster.local.53 > ingress-kong-58cc854b5f-zcffw.38775: 29708 1/0/0 A 52.218.0.123 (60)
12:36:43.992736 IP ingress-kong-58cc854b5f-zcffw.41236 > kube-dns.kube-system.svc.cluster.local.53: 17668+ A? s3.eu-west-1.amazonaws.com. (44)
12:36:44.004826 IP kube-dns.kube-system.svc.cluster.local.53 > ingress-kong-58cc854b5f-zcffw.41236: 17668 1/0/0 A 52.218.84.66 (60)
12:36:50.086898 IP ingress-kong-58cc854b5f-zcffw.45027 > kube-dns.kube-system.svc.cluster.local.53: 29434+ A? s3.eu-west-1.amazonaws.com.fp-cluster-manager.svc.cluster.local. (81)
12:36:50.087741 IP kube-dns.kube-system.svc.cluster.local.53 > ingress-kong-58cc854b5f-zcffw.45027: 29434 NXDomain 0/1/0 (174)
12:36:50.088032 IP ingress-kong-58cc854b5f-zcffw.39585 > kube-dns.kube-system.svc.cluster.local.53: 37315+ A? s3.eu-west-1.amazonaws.com.svc.cluster.local. (62)
12:36:50.088742 IP kube-dns.kube-system.svc.cluster.local.53 > ingress-kong-58cc854b5f-zcffw.39585: 37315 NXDomain 0/1/0 (155)
12:36:50.088979 IP ingress-kong-58cc854b5f-zcffw.58532 > kube-dns.kube-system.svc.cluster.local.53: 58700+ A? s3.eu-west-1.amazonaws.com.cluster.local. (58)
12:36:50.089620 IP kube-dns.kube-system.svc.cluster.local.53 > ingress-kong-58cc854b5f-zcffw.58532: 58700 NXDomain 0/1/0 (151)
12:36:50.089868 IP ingress-kong-58cc854b5f-zcffw.34713 > kube-dns.kube-system.svc.cluster.local.53: 27009+ A? s3.eu-west-1.amazonaws.com.c.razorback-299023.internal. (72)
12:36:50.093879 IP kube-dns.kube-system.svc.cluster.local.53 > ingress-kong-58cc854b5f-zcffw.34713: 27009 NXDomain 0/1/0 (161)
12:36:50.094112 IP ingress-kong-58cc854b5f-zcffw.46707 > kube-dns.kube-system.svc.cluster.local.53: 50172+ A? s3.eu-west-1.amazonaws.com.google.internal. (60)
12:36:50.101850 IP kube-dns.kube-system.svc.cluster.local.53 > ingress-kong-58cc854b5f-zcffw.46707: 50172 NXDomain 0/1/0 (149)
12:36:50.103007 IP ingress-kong-58cc854b5f-zcffw.54399 > kube-dns.kube-system.svc.cluster.local.53: 28438+ A? s3.eu-west-1.amazonaws.com. (44)
12:36:50.111399 IP kube-dns.kube-system.svc.cluster.local.53 > ingress-kong-58cc854b5f-zcffw.54399: 28438 1/0/0 A 52.218.58.3 (60)
```

**Comment by hbagdi** [comment]
cc @Kong/team-k8s

**Comment by rainest** [comment]
@cdrappier does this still occur for you on the current 2.5 patch or 2.6? I know there were some balancer (the Kong proxy DNS subsystem) fixes in those versions that sound similar to this issue.

**Comment by cdrappier** [comment]
In production, the problem appear often (100 time by seconds)
2021/10/20 09:55:55 [warn] 1098#0: *15536 [lua] healthcheckers.lua:150: [healthchecks] failed setting peer status (upstream: 0dc6f45b-8f8d-40d2-a504-473544ee190b:test.test.443.svc): not a known address, context: ngx.timer
Is appearing like 100time by second
We had to set kong log level to error to avoid that.

**Comment by cdrappier** [comment]
It appear that (old article) the healthcheck should be disable with a value of 0
https://docs.konghq.com/gateway-oss/0.12.x/health-checks-circuit-breakers/

It is set to 0 by default, and I think there is a regression on that, cause 0 instead of disable look like doing a loop (spaming log)
```

{
    "algorithm": "round-robin",
    "client_certificate": null,
    "created_at": 1636120493,
    "hash_fallback": "none",
    "hash_fallback_header": null,
    "hash_on": "none",
    "hash_on_cookie": null,
    "hash_on_cookie_path": "/",
    "hash_on_header": null,
    "healthchecks": {
        "active": {
            "concurrency": 10,
            "healthy": {
                "http_statuses": [
                    200,
                    302
                ],
                "interval": 0,
                "successes": 0
            },
            "http_path": "/",
            "https_sni": null,
            "https_verify_certificate": true,
            "timeout": 1,
            "type": "http",
            "unhealthy": {
                "http_failures": 0,
                "http_statuses": [
                    429,
                    404,
                    500,
                    501,
                    502,
                    503,
                    504,
                    505
                ],
                "interval": 0,
                "tcp_failures": 0,
                "timeouts": 0
            }
        },
        "passive": {
            "healthy": {
                "http_statuses": [
                    200,
                    201,
                    202,
                    203,
                    204,
                    205,
                    206,
                    207,
                    208,
                    226,
                    300,
                    301,
                    302,
                    303,
                    304,
                    305,
                    306,
                    307,
                    308
                ],
                "successes": 0
            },
            "type": "http",
            "unhealthy": {
                "http_failures": 0,
                "http_statuses": [
                    429,
                    500,
                    503
                ],
                "tcp_failures": 0,
                "timeouts": 0
            }
        },
        "threshold": 0
    },
    "host_header": null,
    "id": "f4392773-53cc-52f4-9997-705413bae09d",
    "name": "s3.fpdevenv-ktemdg2p.443.svc",
    "slots": 10000,
    "tags": null
}

```
