### ISSUE TITLE
Kong plugin file-log always logs response connection header as close

### ISSUE THREAD

**Issue by mohittevatia** [Kong/kong#12745]
### Is there an existing issue for this?

- [X] I have searched the existing issues

### Kong version (`$ kong version`)

3.6.0

### Current Behavior

Hey team,

We are using kong as an API Gateway in our org.

We see a weird behaviour of logs for **connection** header, we use kong plugin **file-log**.
It really does not matter if i pass connection header as close or keep-alive, the logs generation by plugin **file-log** always returns as **closed**

On the other side the output of http or curl command print whatever is being send as connection header but logs always logs "closed"

### Expected Behavior

Logs printed should match with the output of `curl / http` command i.e. response headers `connection` value should match of terminal output

### Steps To Reproduce

1. Setup kong as per stated in document [Kong](https://docs.konghq.com/gateway/latest/get-started/)
2. Installed plugin using command
```
 curl -X POST http://localhost:8001/plugins/ \
    --data "name=file-log"  \
    --data "config.path=/dev/stdout"
```
3. Run command `http http://localhost:8001` (Without passing header) and `http GET http://localhost:8001 connection:close` 
4. In above command the first will print as as response headers `connection:keep-alive` and the later will print `connection:close`
5. But in stdout for both it prints `"connection": "close"`

**Comment by StarlightIbuki** [comment]
The `file-log` does not customize the behavior of header fetching, and it's calling the original vanilla API `ngx.req.get_header`.
You could debug this issue with tapping tools to confirm the actual received request.

**Comment by mohittevatia** [comment]
Okay thanks for your reply, let me revert with more details

**Comment by mohittevatia** [comment]
Hi @StarlightIbuki 

Today i tried on different port and here are detailed observations:

1. I ran command `http -p hHb localhost:9000` and it gave me response with response and request headers and it has **"keep-alive"** in response

```
GET / HTTP/1.1
Accept: */*
Accept-Encoding: gzip, deflate
Connection: keep-alive
Host: localhost:9000
User-Agent: HTTPie/3.2.2

HTTP/1.1 404 Not Found
Connection: keep-alive
Content-Length: 103
Content-Type: application/json; charset=utf-8
Date: Fri, 22 Mar 2024 05:29:29 GMT
Server: kong/3.6.1
X-Kong-Request-Id: bad1d81dac0b3166c32af84ad5ebf043
X-Kong-Response-Latency: 1

{
    "message": "no Route matched with those values",
    "request_id": "bad1d81dac0b3166c32af84ad5ebf043"
}
```
2. I also installed **wireshark** to capture the packets and respective deep inspection, for the same request i ran on another terminal `sudo tshark -i lo -O http -Y "http.response"  port 9000` and it gave me response as (**Clearly showing the connection as "Keep-alive"**)

```
Capturing on 'Loopback: lo0'
Frame 7: 435 bytes on wire (3480 bits), 435 bytes captured (3480 bits) on interface lo0, id 0
Null/Loopback
Internet Protocol Version 6, Src: ::1, Dst: ::1
Transmission Control Protocol, Src Port: 9000, Dst Port: 56986, Seq: 1, Ack: 136, Len: 359
Hypertext Transfer Protocol
    HTTP/1.1 404 Not Found\r\n
        [Expert Info (Chat/Sequence): HTTP/1.1 404 Not Found\r\n]
            [HTTP/1.1 404 Not Found\r\n]
            [Severity level: Chat]
            [Group: Sequence]
        Response Version: HTTP/1.1
        Status Code: 404
        [Status Code Description: Not Found]
        Response Phrase: Not Found
    Date: Fri, 22 Mar 2024 05:29:29 GMT\r\n
    Content-Type: application/json; charset=utf-8\r\n
    Connection: keep-alive\r\n
    Content-Length: 103\r\n
        [Content length: 103]
    X-Kong-Response-Latency: 1\r\n
    Server: kong/3.6.1\r\n
    X-Kong-Request-Id: bad1d81dac0b3166c32af84ad5ebf043\r\n
    \r\n
    [HTTP response 1/1]
    [Time since request: 0.004758000 seconds]
    [Request in frame: 4]
    [Request URI: http://localhost:9000/]
    File Data: 103 bytes
JavaScript Object Notation: application/json
```

3. Now the logs using plugin "file-logs" has logs for same above request (**Clearly shows response header as "Close**")

```
{
    "source": "kong",
    "latencies": {
        "proxy": -1,
        "kong": 1,
        "request": 2
    },
    "response": {
        "size": 359,
        "status": 404,
        "headers": {
            "connection": "close",
            "x-kong-response-latency": "1",
            "content-type": "application\/json; charset=utf-8",
            "x-kong-request-id": "bad1d81dac0b3166c32af84ad5ebf043",
            "server": "kong\/3.6.1",
            "content-length": "103"
        }
    },
    "client_ip": "192.168.65.1",
    "started_at": 1711085369865,
    "upstream_uri": "",
    "request": {
        "id": "bad1d81dac0b3166c32af84ad5ebf043",
        "headers": {
            "connection": "keep-alive",
            "host": "localhost:9000",
            "accept-encoding": "gzip, deflate",
            "accept": "*\/*",
            "user-agent": "HTTPie\/3.2.2"
        },
        "size": 135,
        "url": "http:\/\/localhost:8000\/",
        "uri": "\/",
        "method": "GET",
        "querystring": {}
    },
    "upstream_status": ""
}
kong-1  | 192.168.65.1 - - [
    22/Mar/2024: 05: 29: 29 +0000
] "GET / HTTP/1.1"404 103 "-""HTTPie/3.2.2" kong_request_id: "bad1d81dac0b3166c32af84ad5ebf043"
kong-1  | 2024/03/22 05: 29: 29 [info
] 1318#0: *6461 client 192.168.65.1 closed keepalive connection
```


Could you please let me know if i am still missing any part?

**Comment by StarlightIbuki** [comment]
@mohittevatia Thanks for spending time on this. We will investigate it.
This seems unlogical and probably is a bug.

**Comment by mohittevatia** [comment]
Great thanks a lot. Let me know if there is anything needed.

**Comment by ms2008** [comment]
This is a known issue, but it's actually a Nginx defect that has existed for almost 10 years.

Ref: https://trac.nginx.org/nginx/ticket/1850

**Comment by mohittevatia** [comment]
Oh i see, thank you linking this issue. Would you recommend any other workaround or fix to exports the logs of kong? Recommend plugin for the time being?

**Comment by ms2008** [comment]
I'm afraid there isn't any workaround for this yet unless you patch Nginx, but that's risky.

**Comment by StarlightIbuki** [comment]
Closing as this cannot be fixed from Kong's side.
